<?xml version="1.0" encoding="UTF-8"?>
<xsd:schema xmlns:xsd="http://www.w3.org/2000/10/XMLSchema" xmlns:od="urn:schemas-microsoft-com:officedata">
<xsd:element name="dataroot">
<xsd:complexType>
<xsd:choice maxOccurs="unbounded">
<xsd:element ref="qryCustomerOrder"/>
</xsd:choice>
</xsd:complexType>
</xsd:element>
<xsd:element name="qryCustomerOrder">
<xsd:annotation>
<xsd:appinfo/>
</xsd:annotation>
<xsd:complexType>
<xsd:sequence>
<xsd:element name="CustomerID" minOccurs="0" od:jetType="text" od:sqlSType="nvarchar">
<xsd:simpleType>
<xsd:restriction base="xsd:string">
<xsd:maxLength value="5"/>
</xsd:restriction>
</xsd:simpleType>
</xsd:element>
<xsd:element name="CompanyName" minOccurs="0" od:jetType="text" od:sqlSType="nvarchar">
<xsd:simpleType>
<xsd:restriction base="xsd:string">
<xsd:maxLength value="40"/>
</xsd:restriction>
</xsd:simpleType>
</xsd:element>
<xsd:element name="OrderID" od:jetType="autonumber" od:sqlSType="int" od:autoUnique="yes" od:nonNullable="yes">
<xsd:simpleType>
<xsd:restriction base="xsd:integer"/>
</xsd:simpleType>
</xsd:element>
<xsd:element name="Subtotal" minOccurs="0" od:jetType="currency" od:sqlSType="money" type="xsd:double"/>
</xsd:sequence>
</xsd:complexType>
</xsd:element>
</xsd:schema>
